no,judul,penerbit,link,PIC,Label Category,tanggal,,,,,,,,,
142,"Gojek Uji Coba Fitur GoRide Nego, Apa Itu?",kompas ,https://www.kompas.com/tren/read/2023/11/01/170000165/gojek-uji-coba-fitur-goride-nego-apa-itu-?,Aji,Local News,01/11/2023,,,,,,,,,
129,"Driver Gojek Bisa Nilai Penumpang, Ini Risiko Rating yang Buruk",Kompas.com,https://www.kompas.com/tren/read/2023/12/13/070000665/driver-gojek-bisa-nilai-penumpang-ini-risiko-rating-yang-buruk,Aji,Local News,13/12/2023,,,,,,,,,
19,"Warganet Mengeluh Sulit Dapat Driver Ojol Jelang Lebaran, Gojek dan Grab Buka Suara",Kompas.com​,https://www.kompas.com/tren/read/2024/04/06/093000165/warganet-mengeluh-sulit-dapat-driver-ojol-jelang-lebaran-gojek-dan-grab,Aji,Opinion,06/04/2024,,,,,,,,,
12,"Penumpang Disebut Harus Bayar Biaya Tambahan Agar Cepat Dapat ""Driver"" Ojol, Ini Kata Gojek",Kompas.com​,https://www.kompas.com/tren/read/2024/12/25/060000965/penumpang-disebut-harus-bayar-biaya-tambahan-agar-cepat-dapat-driver-ojol?page=all,Aji,Local News,25/12/2024,,,,,,,,,
130,"Gojek, Grab, dan Maxim Buka Suara soal Potongan Biaya Aplikasi 30 Persen",Kompas.com,https://www.kompas.com/tren/read/2025/01/18/163000165/gojek-grab-dan-maxim-buka-suara-soal-potongan-biaya-aplikasi-30-persen?page=all,Aji,Local News,18/01/2025,,,,,,,,,
3,Gojek Berevolusi Menjadi Aplikasi Super,Kompas.com​,https://www.kompas.id/artikel/gojek-berevolusi-menjadi-aplikasi-super,Irfan,Local News,27/05/2024,,,,,,,,,
38,"Ojek Online dan Kemitraan Semu, Regulasi yang Tertinggal Satu Dekade",kompas,https://www.kompas.id/artikel/ojek-online-dan-kemitraan-semu-regulasi-yang-tertinggal-satu-dekade?status=sukses_login&utm_source=kompasid&utm_medium=login_paywall&utm_campaign=login&utm_content=https://www.kompas.id/artikel/ojek-online-dan-kemitraan-semu-regulasi-yang-tertinggal-satu-dekade&loc=header,Malvin,Local News,17/08/2022,,,,,,,,,
2,"Pengojek Ancam Mogok Massal, Gojek Jamin Layanan Tetap Jalan",Kompas.com​,https://www.kompas.id/artikel/ribuan-pengemudi-ojek-daring-mogok-besok-layanan-gojek-tetap-berjalan-normal,Irfan,Local News,16/08/2024,,,,,,,,,
110,"Tarif Ojol Bakal Naik, Apakah Semua Pihak Setuju?",Kompas.id,https://www.kompas.id/artikel/tarif-ojol-bakal-naik-apakah-semua-pihak-setuju,Malvin,Academic,28/02/2025,,,,,,,,,
120,Wacana Kenaikan Tarif Jasa Ojol Dinilai Tak Menjawab Tuntutan Pengemudi,Kompas.id,https://www.kompas.id/artikel/wacana-kenaikan-tarif-jasa-ojol-dinilai-tak-menjawab-tuntutan-pengemudi,Malvin,Academic,05/03/2025,,,,,,,,,
6,Pengaruhh E-Commerce (Gojek) terhadap Peningkatan Pendapatan UMKM,Kompasiana,https://www.kompasiana.com/31rafifrizqullah3211/66892538c925c437c4302d23/pengaruhh-e-commerce-gojek-terhadap-peningkatan-pendapatan-umkm,Irfan,Economic,28/01/2022,,,,,,,,,
35,Analisi Opini PT Go-Jek dalam Layanan Jasa Go Food,kompasiana,https://www.kompasiana.com/ahmadfajarmahendra/64a97ae208a8b5240d16bee2/analisi-opini-pt-go-jek-dalam-layanan-jasa-go-food,Malvin,Economic,08/04/2024,,,,,,,,,
7,Gojek Pastikan Perwakilan Ojol yang Temui Wapres Gibran Adalah Mitra Aktif,Kompasiana,https://www.kompasiana.com/berlianinovember1331/68b790d034777c01a9036b12/gojek-pastikan-perwakilan-ojol-yang-temui-wapres-gibran-adalah-mitra-aktif,Irfan,Local News,14/06/2023,,,,,,,,,
93,Kemitraan dan Kesenjangan Perlindungan Tenaga Kerja Ojek Online di Indonesia,Kompasiana,https://www.kompasiana.com/raniarahma5272/686649c1c925c473137ef746/kemitraan-dan-kesenjangan-perlindungan-tenaga-kerja-ojek-online-di-indonesia-realita-buram-dalam-pekerja-ojek-online-di-tengah-kilau-ekonomi-digital,Malvin,Academic,05/04/2023,,,,,,,,,
8,"Ketika Akun Gojek Tersuspend, Saya Tak Tahu Lagi Harus Memberi Makan Anak Istri Dengan Apa",Kompasiana,https://www.kompasiana.com/supriadigoo84/68595b8f34777c7ee33c6522/ketika-akun-gojek-tersuspend-saya-tak-tahu-lagi-harus-memberi-makan-anak-istri-dengan-apa,Irfan,Opinion,10/10/2023,,,,,,,,,
176,"Tarif ojol naik, driver ojek online semringah harap pendapatan melonjak",Liputan6.com,https://www.liputan6.com/bisnis/read/5066769/tarif-ojol-naik-driver-ojek-online-semringah-harap-pendapatan-melonjak,Malvin,Economic,10/09/2022,,,,,,,,,
34,Gojek Tindak Oknum Mitra yang Larang Pengemudi Ojol Angkut Penumpang saat Demo,liputan6,https://www.liputan6.com/bisnis/read/5687782/gojek-tindak-oknum-mitra-yang-larang-pengemudi-ojol-angkut-penumpang-saat-demo,Irfan,Local News,11/08/2024,,,,,,,,,
33,"Menaker Siapkan Aturan Ojol Dapat THR, Gojek Sebut Mereka Bukan Karyawan Tetap",liputan6,https://www.liputan6.com/hot/read/5926502/menaker-siapkan-aturan-ojol-dapat-thr-gojek-sebut-mereka-bukan-karyawan-tetap,Irfan,Local News,21/12/2024,,,,,,,,,
146,Gojek: Aplikasi Tetap Berjalan Normal Meski Ada Aksi/Unjuk Rasa,liputan6,https://www.liputan6.com/news/read/2024/08/29/ribuan-ojol-bakal-demo-hari-ini-gojek-aplikasi-tetap-berjalan-normal,Aji,Local News,29/08/2024,,,,,,,,,
32,Senangnya Driver Ojol di Bandung dan Semarang Dapat Helm Gratis,liputan6,https://www.liputan6.com/otomotif/read/5981783/senangnya-driver-ojol-di-bandung-dan-semarang-dapat-helm-gratis,Irfan,Opinion,21/08/2024,,,,,,,,,
200,"Pendapatan GoTO Naik Jadi Rp 15,89 Triliun, Rugi Susut 95 Persen pada 2024",Liputan6.com,https://www.liputan6.com/saham/read/5957557/pendapatan-goto-naik-jadi-rp-1589-triliun-rugi-susut-95-persen-pada-2024,Malvin,Economic,02/07/2025,,,,,,,,,
151,"Diperbarui, Tampilan Aplikasi Go-Jek Makin Kekinian",liputan6,https://www.liputan6.com/tekno/read/3263118/diperbarui-tampilan-aplikasi-go-jek-makin-kekinian,Aji,Local News,06/01/2018,,,,,,,,,
18,"Warganet Keluhkan Aplikasi Gojek Error di Medsos, Sulit Bayar Pakai Gopay",Liputan6.com,https://www.liputan6.com/tekno/read/5523551/warganet-keluhkan-aplikasi-gojek-error-di-medsos-sulit-bayar-pakai-gopay,Aji,Opinion,07/02/2024,,,,,,,,,
155,"Gojek responds to protest on incentive changes, says drivers involved in discussions",Marketing-Interactive,https://www.marketing-interactive.com/gojek-responds-to-protest-on-incentive-changes-says-drivers-involved-in-discussions,Aji,Foreign News,07/082019,,,,,,,,,
137,"Sempat Error, Aplikasi Gojek Kembali Normal Siang Ini",Metropolitan.id,https://www.metropolitan.id/berita-hari-ini/95310133446/sempat-error-aplikasi-gojek-kembali-normal-siang-ini,Aji,Local News,12/09/2023,,,,,,,,,
175,Tarif ojol naik bikin konsumen dan pengemudi sama-sama dirugikan,Metro TV News,https://www.metrotvnews.com/read/k8oCV78a-kenaikan-tarif-ojol-bikin-konsumen-dan-pengemudi-sama-sama-dirugikan,Malvin,Economic,02/07/2025,,,,,,,,,
163,Konsumen hingga pengemudi bakal dirugikan,Metro TV News,https://www.metrotvnews.com/read/NA0CE3y6-tarif-ojol-naik-15-konsumen-hingga-pengemudi-bakal-dirugikan,Malvin,Economic,02/07/2025,,,,,,,,,
121,Mayoritas Konsumen Ojek Online Mengeluhkan Tarif Tinggi,Neraca.co.id,https://www.neraca.co.id/article/117130/mayoritas-konsumen-ojek-online-mengeluhkan-tarif-tinggi,Malvin,Academic,28/02/2025,,,,,,,,,
127,"Gojek dan Gopay Error, Pengguna Keluhkan di Media Sosial",iNewsTasikmalaya,https://www.rctiplus.com/news/detail/terkini/4245163/gojek-dan-gopay-error-pengguna-keluhkan-di-media-sosial-netizen-sama-nder-punya-gw-eror,Aji,Local News,07/02/2024,,,,,,,,,
24,“Recent hidden change in Gojek app?”,Reddit,https://www.reddit.com/r/indonesia/comments/1bp2qj7/recent_hidden_change_in_gojek_app/,Aji,Opinion,27/03/2024,,,,,,,,,
122,Survei: Mayoritas Pengguna Ojol Keberatan Bila Tarif Naik,Sinar Harapan,https://www.sinarharapan.co/ekonomi/pr-3852807207/Survei-Mayoritas-Pengguna-Ojol-Keberatan-Bila-Tarif-Naik,Malvin,Academic,03/03/2025,,,,,,,,,
201,"GOTO Catat Rugi Rp580 Miliar Semester I/2025, Efisiensi Biaya dan Kenaikan Pendapatan Dorong Perbaikan Kinerja",Stabilitas.id,https://www.stabilitas.id/goto-catat-rugi-rp580-miliar-semester-i-2025-efisiensi-biaya-dan-kenaikan-pendapatan-dorong-perbaikan-kinerja/,Malvin,Economic,02/07/2025,,,,,,,,,
138,"Gojek diduga error, banyak pengguna keluh-kesah",Tek.id,https://www.tek.id/tek/gojek-diduga-error-banyak-pengguna-keluh-kesah-b2icm9rot,Aji,Local News,11/12/2023,,,,,,,,,
141,"Aplikasi Gojek Bermasalah Sore Ini, Ramai Keluhan Pengguna-Pengemudi",Tempo ,https://www.tempo.co/digital/aplikasi-gojek-bermasalah-sore-ini-ramai-keluhan-pengguna-pengemudi-229639,Aji,Local News,13/01/2023,,,,,,,,,
185,Investasi Google ke Gojek dan Kaitannya dengan Kasus Korupsi Chromebook yang Disisir Kejagung,Tempo.co,https://www.tempo.co/digital/investasi-google-ke-gojek-dan-kaitannya-dengan-kasus-korupsi-chromebook-yang-disisir-kejagung-2049060,Malvin,Economic,27/12/2023,,,,,,,,,
189,Alasan Gojek dan Grab Tolak Tuntutan Ojol Ubah Status Kemitraan,Tempo.co,https://www.tempo.co/ekonomi/alasan-gojek-dan-grab-tolak-tuntutan-ojol-ubah-status-kemitraan-1493889,Malvin,Economic,12/02/2021,,,,,,,,,
154,"Aplikasi Gojek Error Pagi Ini, Pengguna: Saldo Terpotong tapi Order Enggak Masuk",Tempo ,https://www.tempo.co/ekonomi/aplikasi-gojek-error-pagi-ini-pengguna-saldo-terpotong-tapi-order-enggak-masuk-145034,Aji,Local News,12/09/2023,,,,,,,,,
13,"Aplikasi Gojek Punya Fitur Chat untuk Kirim Pesan ke Pengguna Lain dan Pengemudi, Ini Cara Pakainya",Tempo.co,https://www.tempo.co/ekonomi/aplikasi-gojek-punya-fitur-chat-untuk-kirim-pesan-ke-pengguna-lain-dan-pengemudi-ini-cara-pakainya--173859,Aji,Local News,21/06/2023,,,,,,,,,
195,Asosiasi Ojol Kecam Bonus Hari Raya Rp 50 Ribu: Praktik Perbudakan Sistematis,Tempo.co,https://www.tempo.co/ekonomi/asosiasi-ojol-kecam-bonus-hari-raya-rp-50-ribu-praktik-perbudakan-sistematis-1224065,Malvin,Local News,29/04/2019,,,,,,,,,
194,Celios Waspadai Monopoli dan Predatory Pricing dari Rencana Merger GoTo dan Grab,Tempo.co,https://www.tempo.co/ekonomi/celios-waspadai-monopoli-dan-predatory-pricing-dari-rencana-merger-goto-dan-grab-1414249,Malvin,Economic,22/10/2020,,,,,,,,,
168,Ekonom UPN sebut kenaikan tarif ojol tak otomatis tingkatkan kesejahteraan,Tempo.co,https://www.tempo.co/ekonomi/ekonom-upn-sebut-kenaikan-tarif-ojol-tak-otomatis-menaikkan-kesejahteraan-pengemudi-1905391,Malvin,Economic,02/07/2025,,,,,,,,,
184,Empat Aplikator Ojek Online Bicara soal Pengemudi Ojol yang Bertemu Gibran,Tempo.co,https://www.tempo.co/ekonomi/empat-aplikator-ojek-online-bicara-soal-pengemudi-ojol-yang-bertemu-gibran-2066435,Malvin,Politic,29/02/2024,,,,,,,,,
21,Gojek Buka Suara Soal Aplikasinya yang Error: Saat Ini Pelanggan Dapat Kembali Memesan Layanan,Tempo.co,https://www.tempo.co/ekonomi/gojek-buka-suara-soal-aplikasinya-yang-error-saat-ini-pelanggan-dapat-kembali-memesan-layanan-145028?,Aji,Local News,12/12/2023,,,,,,,,,
17,Gojek Buka Suara Soal Biaya Tambahan Fitur Pencarian Cepat: Sifatnya Opsional,Tempo.co,https://www.tempo.co/ekonomi/gojek-buka-suara-soal-biaya-tambahan-fitur-pencarian-cepat-sifatnya-opsional-1186729,Aji,Local News,27/12/2024,,,,,,,,,
191,Gojek Pastikan Operasional Berjalan Normal walau Ada Demo Pengemudi Ojol,Tempo.co,https://www.tempo.co/ekonomi/gojek-pastikan-operasional-berjalan-normal-walau-ada-demo-pengemudi-ojol-1493713,Malvin,Local News,12/02/2021,,,,,,,,,
192,GoTo soal Tawaran Merger dengan Grab: Seringkali Disampaikan secara Informal,Tempo.co,https://www.tempo.co/ekonomi/goto-soal-tawaran-merger-dengan-grab-seringkali-disampaikan-secara-informal-1454251,Malvin,Economic,10/12/2020,,,,,,,,,
197,Kemnaker Ungkap Alasan Aplikator Beri Bantuan Hari Raya Rp 50 Ribu untuk Pengemudi Ojol,Tempo.co,https://www.tempo.co/ekonomi/kemnaker-ungkap-alasan-aplikator-beri-bantuan-hari-raya-rp-50-ribu-untuk-pengemudi-ojol-1224437,Malvin,Politic,30/04/2019,,,,,,,,,
173,Kenaikan tarif ojol dinilai hanya akan menguntungkan aplikator,Tempo.co,https://www.tempo.co/ekonomi/mengapa-ide-kenaikan-tarif-ojol-hanya-akan-untungkan-aplikator--1915257,Malvin,Opinion,03/07/2025,,,,,,,,,
183,Mengapa Pertemuan Pengemudi Ojol dengan Wapres Gibran Diragukan,Tempo.co,https://www.tempo.co/ekonomi/mengapa-pertemuan-pengemudi-ojol-dengan-wapres-gibran-diragukan-2066162,Malvin,Politic,29/02/2024,,,,,,,,,
190,Menhub Respons Desakan Pengemudi Ojol agar Komisi Turun jadi 10 Persen,Tempo.co,https://www.tempo.co/ekonomi/menhub-respons-desakan-pengemudi-ojol-agar-komisi-turun-jadi-10-persen-1493734,Malvin,Politic,12/02/2021,,,,,,,,,
198,"Pendapatan GoTo dari Ojek Online Rp 1,4 Triliun dalam 6 Bulan",Tempo.co,https://www.tempo.co/ekonomi/pendapatan-goto-dari-ojek-online-rp-1-4-triliun-dalam-6-bulan-2058716,Malvin,Economic,17/01/2024,,,,,,,,,
193,Penjelasan Grab Indonesia soal Merger dengan Gojek: Spekulasi yang Tak Terverifikasi,Tempo.co,https://www.tempo.co/ekonomi/penjelasan-grab-indonesia-soal-merger-dengan-gojek-spekulasi-yang-tak-terverifikasi-1444055,Malvin,Economic,02/12/2020,,,,,,,,,
30,"PPKM Dicabut, Driver Ojol Cerita Orderan Meningkat dan Agak Bertubi-tubi",tempo,https://www.tempo.co/ekonomi/ppkm-dicabut-driver-ojol-cerita-orderan-meningkat-dan-agak-bertubi-tubi-230015,Irfan,Local News,30/09/2019,,,,,,,,,
196,"Prabowo Sebut Ojek Online Mendapat Bonus Rp 1 Juta, SPAI: Yang Didapat Rp 50 Ribu",Tempo.co,https://www.tempo.co/ekonomi/prabowo-sebut-ojek-online-mendapat-bonus-rp-1-juta-spai-yang-didapat-rp-50-ribu-1223433,Malvin,Politic,28/04/2019,,,,,,,,,
9,SPAI: Merger Gojek Grab Picu Monopoli dan Turunkan Pendapatan Ojol,TEMPO,https://www.tempo.co/ekonomi/spai-merger-gojek-grab-picu-monopoli-dan-turunkan-pendapatan-ojol-1461419,Irfan,Economic,22/08/2024,,,,,,,,,
117,Survei Terbaru: 75 Persen Konsumen Tolak Tarif Baru Ojek Online,Tempo.co,https://www.tempo.co/ekonomi/survei-terbaru-75-persen-konsumen-tolak-tarif-baru-ojek-online-747325,Malvin,Academic,04/03/2025,,,,,,,,,
177,"Tarif ojol naik, pengemudi ojol curhat: pendapatan turun 50 persen",Tempo.co,https://www.tempo.co/ekonomi/tarif-ojol-naik-pengemudi-ojol-curhat-pendapatan-turun-50-persen-aplikator-potong-20-persen-lebih-289658,Malvin,Economic,02/07/2025,,,,,,,,,
31,"Kurir Gosend Bawa Kabur Kamera Rp 28 Juta, Gojek Tidak Toleransi Pencuria",tempo,https://www.tempo.co/hukum/kurir-gosend-bawa-kabur-kamera-rp-28-juta-gojek-tidak-toleransi-pencurian-185495,Irfan,Local News,06/05/2025,,,,,,,,,
187,"Ojol Mogok Besok, Tuduh Aplikator Langgar Peraturan Menteri",Tempo.co,https://www.tempo.co/hukum/ojol-mogok-besok-tuduh-aplikator-langgar-peraturan-menteri--1483885,Malvin,Local News,19/10/2021,,,,,,,,,
186,Abai Negara Melindungi Pengemudi Ojek Online,Tempo.co,https://www.tempo.co/kolom/status-pengemudi-ojek-online-1521316,Malvin,Local News,,,,,,,,,,
199,Agar GoTo Tak Ambrol,Tempo.co,https://www.tempo.co/newsletter/agar-goto-tak-ambrol-259567,Malvin,Opinion,23/11/2022,,,,,,,,,
157,Gojek pastikan tarif ojol sesuai regulasi dan daya beli masyarakat,Tribunnews,https://www.tribunnews.com/bisnis/2025/07/02/ada-wacana-kenaikan-tarif-gojek-pastikan-tarif-ojol-sesuai-regulasi-dan-daya-beli-masyarakat,Malvin,Economic,24/02/2025,,,,,,,,,
106,"Hasil Survei: Mayoritas Masyarakat Tak Setuju Tarif Ojol Naik, Pilih Beralih ke Kendaraan Pribadi",Tribunnews,https://www.tribunnews.com/nasional/2022/09/11/hasil-survei-mayoritas-masyarakat-tak-setuju-tarif-ojol-naik-pilih-beralih-ke-kendaraan-pribadi,Malvin,Academic,02/02/2024,,,,,,,,,